[
  {
    "$groupableName": "A",
    "advisors": [],
    "category": "Departments",
    "contacts": [],
    "description": "The Academic Success Center provides resources for all St. Olaf students as they work to maximize their full academic potential. We collaborate with faculty, staff, and other campus partners to provide a range of services, programs, and resources to support student learning at no",
    "lastUpdated": "2000-01-01",
    "meetingLocation": "",
    "meetingTime": "",
    "meetings": "",
    "memberCount": 1,
    "name": "Academic Success Center",
    "organizationUri": "academic-success-center",
    "photoUrl": "",
    "website": ""
  },
  {
    "$groupableName": "A",
    "advisors": [],
    "category": "Religious",
    "contacts": [],
    "description": "The purpose of this organization is to create a St. Olaf Official, fully student-run, faith-based organization and fosters a welcoming and inclusive environment where students can come learn about the teachings of Jesus. This organization puts a huge emphasis on EVERYONE being tr",
    "lastUpdated": "2000-01-01",
    "meetingLocation": "Norway Room",
    "meetingTime": "7pm-8pm",
    "meetings": "Norway Room, 7pm-8pm",
    "memberCount": 16,
    "name": "Agape",
    "organizationUri": "agape",
    "photoUrl": "",
    "website": ""
  },
  {
    "$groupableName": "A",
    "advisors": [],
    "category": "Performance, Special Interest",
    "contacts": [],
    "description": "Named for several founding women of the college, Agnes A Cappella is a treble-voice a cappella group with the purpose to prepare and perform a cappella music and create a fun and collaborative environment for music making. We are student run and arrange all of our own music!",
    "lastUpdated": "2000-01-01",
    "meetingLocation": "",
    "meetingTime": "",
    "meetings": "",
    "memberCount": 12,
    "name": "Agnes A Cappella",
    "organizationUri": "agnes-a-cappella",
    "photoUrl": "",
    "website": ""
  },
  {
    "$groupableName": "A",
    "advisors": [],
    "category": "Pre-Professional, Service",
    "contacts": [],
    "description": "Alpha Epsilon Delta (AED) is a pre-professional honor society that provides St. Olaf pre-health students with career-building resources and service opportunities.  We celebrate academic excellence and build a supportive network of peers, educators, and professionals.AED is the ol",
    "lastUpdated": "2000-01-01",
    "meetingLocation": "",
    "meetingTime": "",
    "meetings": "",
    "memberCount": 23,
    "name": "Alpha Epsilon Delta (AED)",
    "organizationUri": "alpha-epsilon-delta-aed",
    "photoUrl": "",
    "website": ""
  },
  {
    "$groupableName": "A",
    "advisors": [],
    "category": "Service",
    "contacts": [],
    "description": "St. Olaf's Service and Leadership Co-ed Fraternity. We hold daily events to foster the love of leadership, friendship, and service among our members.",
    "lastUpdated": "2000-01-01",
    "meetingLocation": "RML 525",
    "meetingTime": "Sunday at 6 pm",
    "meetings": "RML 525, Sunday at 6 pm",
    "memberCount": 18,
    "name": "Alpha Phi Omega (APO)",
    "organizationUri": "alpha-phi-omega-apo",
    "photoUrl": "",
    "website": ""
  },
  {
    "$groupableName": "A",
    "advisors": [],
    "category": "Departments",
    "contacts": [],
    "description": "",
    "lastUpdated": "2000-01-01",
    "meetingLocation": "",
    "meetingTime": "",
    "meetings": "",
    "memberCount": 2,
    "name": "Alumni and Parent Relations",
    "organizationUri": "alumni-and-parent-relations",
    "photoUrl": "",
    "website": ""
  },
  {
    "$groupableName": "A",
    "advisors": [],
    "category": "Religious",
    "contacts": [],
    "description": "Amazing Student Ministry is a student organization that strives for a spiritual revival on St Olaf campus. We seek to grow deeper in our faith and have the boldness of Christ’s witnesses. We are a prayer room for those who hunger and thirst for the presence of God and the manifes",
    "lastUpdated": "2000-01-01",
    "meetingLocation": "Boe Chapel or RML 515",
    "meetingTime": "Friday 7-8:30pm",
    "meetings": "Boe Chapel or RML 515, Friday 7-8:30pm",
    "memberCount": 7,
    "name": "Amazing Student Ministry",
    "organizationUri": "amazing-student-ministry",
    "photoUrl": "",
    "website": ""
  },
  {
    "$groupableName": "A",
    "advisors": [],
    "category": "Academic",
    "contacts": [],
    "description": "Pre-Professional group. Student chapter of National American Choral Directors Association.",
    "lastUpdated": "2000-01-01",
    "meetingLocation": "n/a",
    "meetingTime": "n/a",
    "meetings": "n/a, n/a",
    "memberCount": 53,
    "name": "American Choral Directors Association (ACDA)",
    "organizationUri": "american-choral-directors-association-acda-2",
    "photoUrl": "",
    "website": ""
  },
  {
    "$groupableName": "A",
    "advisors": [],
    "category": "Academic, Special Interest",
    "contacts": [],
    "description": "Welcome! We are a welcoming community for signers of all levels to connect, chat, and learn from each other. Whether you're fluent or brand new, our focus is on relaxed, conversational signing together.Meetings: Weekly on Thursdays from 5:30-6:30pm in RML 520.Fall Co-Curricular F",
    "lastUpdated": "2000-01-01",
    "meetingLocation": "RML 520",
    "meetingTime": "5:30-6:30pm",
    "meetings": "RML 520, 5:30-6:30pm",
    "memberCount": 43,
    "name": "American Sign Language Club",
    "organizationUri": "american-sign-language-club-2",
    "photoUrl": "",
    "website": ""
  },
  {
    "$groupableName": "A",
    "advisors": [],
    "category": "Special Interest",
    "contacts": [],
    "description": "Our goal is to give Oles accessible, approachable opportunities to develop engineering skills supported by shared knowledge, manufacturing resources, and hands-on tools. We aim to build an inclusive community for all engineering-minded students, where participants and leaders can",
    "lastUpdated": "2000-01-01",
    "meetingLocation": "",
    "meetingTime": "",
    "meetings": "",
    "memberCount": 28,
    "name": "Applied Engineering Club",
    "organizationUri": "applied-engineering-club",
    "photoUrl": "",
    "website": ""
  },
  {
    "$groupableName": "A",
    "advisors": [],
    "category": "Academic, Multicultural",
    "contacts": [],
    "description": "Arabic is one of the most widely spoken languages in the world. For anyone aspiring to learn more about the culture in Arabic-speaking regions, learning or improving the language is an invaluable skill.ASO  is a student-led space fostering community, relationships, and conversati",
    "lastUpdated": "2000-01-01",
    "meetingLocation": "",
    "meetingTime": "",
    "meetings": "",
    "memberCount": 15,
    "name": "Arabic Club",
    "organizationUri": "arabic-club",
    "photoUrl": "",
    "website": ""
  },
  {
    "$groupableName": "A",
    "advisors": [],
    "category": "Multicultural",
    "contacts": [],
    "description": "The Armenian Student Association at St. Olaf aims to promote cultural understanding and create a welcoming space for all who wish to explore and engage with Armenian history, politics, and culture. We are committed to fostering a lasting appreciation for the Armenian culture amon",
    "lastUpdated": "2000-01-01",
    "meetingLocation": "",
    "meetingTime": "",
    "meetings": "",
    "memberCount": 10,
    "name": "Armenian Student Association",
    "organizationUri": "armenian-student-association",
    "photoUrl": "",
    "website": ""
  },
  {
    "$groupableName": "A",
    "advisors": [],
    "category": "Special Interest",
    "contacts": [],
    "description": "To provide students with a space to create and learn about art in a relaxed and welcoming atmosphere. Give students information about local art resources and create a space for people with common interests to get to know one another.",
    "lastUpdated": "2000-01-01",
    "meetingLocation": "DiSCO Cave",
    "meetingTime": "Mondays, 6 - 7 PM",
    "meetings": "DiSCO Cave, Mondays, 6 - 7 PM",
    "memberCount": 75,
    "name": "Art Club",
    "organizationUri": "art-club",
    "photoUrl": "",
    "website": ""
  },
  {
    "$groupableName": "A",
    "advisors": [],
    "category": "Multicultural",
    "contacts": [],
    "description": "Asian Student Union (ASU) seeks to create a community across the experiences of Americans of Asian ancestry and Asians in the United States. We work to advocate for and support the identities of Asian Americans and Asians in the United States. Our meetings provide a safe space fo",
    "lastUpdated": "2000-01-01",
    "meetingLocation": "BC 144 or New Hall 1st Floor Kitchen",
    "meetingTime": "Wednesdays Biweekly 5-6pm",
    "meetings": "BC 144 or New Hall 1st Floor Kitchen, Wednesdays Biweekly 5-6pm",
    "memberCount": 47,
    "name": "Asian Student Union (ASU)",
    "organizationUri": "asian-student-union-asu",
    "photoUrl": "",
    "website": ""
  },
  {
    "$groupableName": "A",
    "advisors": [],
    "category": "Academic",
    "contacts": [],
    "description": "Aspiring Educators is a pre-professional organization for college students who plan to be teachers or are interested in educational systems. The elected leaders meet every other week to plan events, bring education students together through professional development, and work towa",
    "lastUpdated": "2000-01-01",
    "meetingLocation": "",
    "meetingTime": "",
    "meetings": "",
    "memberCount": 16,
    "name": "Aspiring Educators",
    "organizationUri": "aspiring-educators",
    "photoUrl": "",
    "website": ""
  },
  {
    "$groupableName": "A",
    "advisors": [],
    "category": "Academic",
    "contacts": [],